Date,Location,Job,Offer_Decision,Experience,Interview_Diff,Application_Text,Interview_Text,InterviewQs
"Oct 9, 2018","Anonymous Employee in Ellenwood, GA",Part Time Package Handler Interview,Accepted Offer,Positive Experience,Easy Interview,"I applied online. The process took a week. I interviewed at FedEx (Ellenwood, GA) in October 2018.",Application,Q: Have I ever had to deal with an unhappy customer and how did I deal with them?   Answer Question
"Sep 29, 2018","Anonymous Employee in Memphis, TN",Customer Service Representative Interview,Accepted Offer,Positive Experience,Average Interview,"I applied online. The process took 2 weeks. I interviewed at FedEx (Memphis, TN) in September 2018.",Application,Describe a time when you had to handle a situation alone and what were the result of your actions   Answer Question
"Sep 28, 2018","Anonymous Interview Candidate in Memphis, TN",Senior Financial Analyst Interview,Declined Offer,Positive Experience,Average Interview,"I applied online. The process took 4+ weeks. I interviewed at FedEx (Memphis, TN) in August 2018.",Application,Project mgmt?   2 Answers
"Sep 24, 2018","Anonymous Employee in Dallas, TX",Retail Customer Service Interview,Accepted Offer,Positive Experience,Easy Interview,"I applied online. I interviewed at FedEx (Dallas, TX).",Application,Why do you want to work for fedex   Answer Question
"Sep 21, 2018","Anonymous Employee in Dallas, TX",Part Time Package Handler Interview,Accepted Offer,Positive Experience,Easy Interview,"I interviewed at FedEx (Dallas, TX) in March 2017.",Application,When have you shown extraordinary leadership?   Answer Question
"Sep 19, 2018","Anonymous Employee in Manassas, VA",Part Time Package Handler Interview,Accepted Offer,Positive Experience,Easy Interview,"I applied through an employee referral. The process took a week. I interviewed at FedEx (Manassas, VA) in April 2018.",Application,Tell me about yourself.   Answer Question
"Sep 18, 2018","Anonymous Employee in Memphis, TN",Material Handler Interview,Accepted Offer,Positive Experience,Easy Interview,"I applied through a recruiter. The process took 1 day. I interviewed at FedEx (Memphis, TN) in June 2015.",Application,What shift can you work?   1 Answer
"Sep 16, 2018","Anonymous Employee in Sanford, FL",Part Time Package Handler Interview,Accepted Offer,Positive Experience,Easy Interview,"I applied online. I interviewed at FedEx (Sanford, FL).",Application,What would you do if a customer complains about their item ?   Answer Question
"Sep 5, 2018","Anonymous Employee in New Orleans, LA",Material Handler Interview,Accepted Offer,Positive Experience,Easy Interview,"I applied online. The process took 1+ week. I interviewed at FedEx (New Orleans, LA).",Application,Are you sure you want this job?   Answer Question
"Aug 31, 2018",Anonymous Employee,Assistant Manager Interview,Accepted Offer,Positive Experience,Average Interview,I applied online. The process took 3 weeks. I interviewed at FedEx.,Application,"give examples on handling issues with employees, coaching/training styles, how teams under you in the past performed to reach goals, etc.   Answer Question"
"Aug 31, 2018",Anonymous Employee,Information Security Interview,Accepted Offer,Positive Experience,Average Interview,I applied through an employee referral. The process took 2 weeks. I interviewed at FedEx.,Application,Mention one of your failures and how you recovered from it?   Answer Question
"Aug 18, 2018",Anonymous Employee,Operations Administrator Interview,Accepted Offer,Positive Experience,Average Interview,I applied in-person. The process took 2 weeks. I interviewed at FedEx.,Application,1 personnel question and 4 BAR questions   1 Answer
"Aug 13, 2018","Anonymous Interview Candidate in Portland, OR",Package Handler Interview,Declined Offer,Positive Experience,Easy Interview,"I applied online. The process took 2 weeks. I interviewed at FedEx (Portland, OR) in June 2017.",Application,Can you buy your own Steel Toed Shoes for the first 6 months?   1 Answer
"Aug 9, 2018","Anonymous Employee in Pearl, MS",Delivery Driver Interview,Accepted Offer,Positive Experience,Easy Interview,"I applied online. I interviewed at FedEx (Pearl, MS) in July 2018.",Application,How would you handle an irate customer   1 Answer
"Aug 8, 2018","Anonymous Employee in Charlotte, NC",Customer Service Representative Interview,Accepted Offer,Positive Experience,Difficult Interview,"I applied online. The process took a week. I interviewed at FedEx (Charlotte, NC) in March 2017.",Application,How my day was.   1 Answer
"Aug 8, 2018","Anonymous Employee in Albuquerque, NM",Courier Interview,Accepted Offer,Positive Experience,Easy Interview,"I applied online. The process took 1 day. I interviewed at FedEx (Albuquerque, NM) in September 2014.",Application,Why should we hire you for this position?   Answer Question
"Aug 7, 2018","Anonymous Employee in Toronto, ON (Canada)",Customer Service Interview,Accepted Offer,Positive Experience,Easy Interview,"I applied online. The process took 3 weeks. I interviewed at FedEx (Toronto, ON (Canada)) in February 2017.",Application,How would you deal with a difficult client?   Answer Question
"Aug 7, 2018","Anonymous Interview Candidate in Memphis, TN",Ops Administrative Interview,No Offer,Positive Experience,Average Interview,"I applied in-person. I interviewed at FedEx (Memphis, TN) in August 2018.",Application,Why should we hire you for this position?   Answer Question
"Jul 31, 2018","Anonymous Employee in New York, NY",Dock Worker Interview,Accepted Offer,Positive Experience,Easy Interview,"I applied online. The process took 1 day. I interviewed at FedEx (New York, NY) in January 2014.",Application,Do you have experience in freight?   1 Answer
"Jul 31, 2018",Anonymous Interview Candidate,Account Executive - Market Development Interview,No Offer,Negative Experience,Average Interview,I applied online. The process took 2+ months. I interviewed at FedEx in June 2018.,Application,Tell me about a specific time you won over business when you were not the lowest price.   Answer Question
"Jul 27, 2018","Anonymous Interview Candidate in Memphis, TN",Pricing Analyst Interview,No Offer,Negative Experience,Easy Interview,"I applied online. I interviewed at FedEx (Memphis, TN) in June 2018.",Application,tell me about difficult situations how will you react   Answer Question
"Jul 27, 2018",Anonymous Employee,Package Handler Interview,Accepted Offer,Positive Experience,,The interview was very fast and very concerned with saftey and well being of the employee. The gentleman who interviewed me encourages my path to further my education to be a Paramedic.,Application,why do you want to work with FedEx?   Answer Question
"Jul 26, 2018","Anonymous Employee in Memphis, TN",Associate Business Planning Analyst Interview,Accepted Offer,Positive Experience,Average Interview,"I applied online. I interviewed at FedEx (Memphis, TN) in September 2017.",Application,A time where you went beyond and solved a problem in your previous work experience or any time in life I answered a scenario from my previous work experience where I have learnt to solve a problem seeing it on my own .There are the 5 main points they take the interview on Initiative Creativity Resourcefulness Analytical Thinking Determination Results-Oriented.The interview process was mostly behavioural questions not specifically related to…  the course of study.   1 AnswerShow More
"Jul 25, 2018","Anonymous Interview Candidate in Ellenwood, GA",Operations Manager Interview,No Offer,Positive Experience,Easy Interview,"I applied online. The process took 2 weeks. I interviewed at FedEx (Ellenwood, GA) in July 2018.",Application,"Describe a job you had to do and you did not like. They ask the backstory, your actions, and the results.   Answer Question"
"Jul 24, 2018","Anonymous Interview Candidate in Cincinnati, OH",Senior Pricing Analyst Interview,Declined Offer,Positive Experience,Average Interview,"I applied online. I interviewed at FedEx (Cincinnati, OH) in April 2018.",Application,Case study   Answer Question
"Jul 12, 2018","Anonymous Employee in Twi-gol, Hamgyong-bukto (North Korea)",Part Time Package Handler Interview,Accepted Offer,Negative Experience,Easy Interview,"I applied online. I interviewed at FedEx (Twi-gol, Hamgyong-bukto (North Korea)) in March 2017.",Application,
"Jul 8, 2018","Anonymous Employee in Memphis, TN",Pricing Analyst Interview,Accepted Offer,Positive Experience,Average Interview,"I applied online. The process took 3+ months. I interviewed at FedEx (Memphis, TN).",Application,Describe a challeging yet critical situation that you overcame in a short period of time.   Answer Question
"Jul 5, 2018",Anonymous Employee,PT Package Handler Interview,Accepted Offer,Positive Experience,Easy Interview,I applied online. The process took 4 days. I interviewed at FedEx in July 2018.,Application,Can you lift 50 pounds by yourself?   1 Answer
"Jun 25, 2018",Anonymous Interview Candidate,Part Time Package Handler Interview,Declined Offer,Neutral Experience,Easy Interview,I applied online. I interviewed at FedEx.,Application,Can you pick up around 50lbs constantly?   Answer Question
"Jun 22, 2018","Anonymous Interview Candidate in Tempe, AZ",Pricing Analyst Interview,No Offer,Positive Experience,Difficult Interview,"I applied online. The process took 1 day. I interviewed at FedEx (Tempe, AZ) in April 2018.",Application,"1. Have you done any financial analysis (Following questions: what's the assumption of the project? what's the result of the project?)

2. Have you done any decision without perfect information

3. How you describe the relationship between you and your supervisor

4. Have you initialized any analytics project because you see opportunity for the organization

5. Have done any task that satisfied multi-parties' business needs (Following questions : any risk involved in your decision)…    Answer QuestionShow More"
"Jun 21, 2018","Anonymous Interview Candidate in Mississauga, ON (Canada)",Customer Service Representative Interview,No Offer,Positive Experience,Average Interview,"I applied online. The process took 3 weeks. I interviewed at FedEx (Mississauga, ON (Canada)) in June 2018.",Application,"Behavioral interview* about 3-4 questions and you need to be specific.
1. tell us a time when you had to deal with an irate customer b/c of a company policy and how did you explain that policy to them and resolve the issue?
2. Tell us a time when you seen an employee do something wrong and how did you handle it?
3. How do you deal with an upset customer?   …  href=""/Interview/Behavioral-interview-about-3-4-questions-and-you-need-to-be-specific-1-tell-us-a-time-when-you-had-to-deal-with-an-irat-QTN_2686717.htm"" class=""questionResponse"">Answer QuestionShow More"
"Jun 20, 2018",Anonymous Interview Candidate,Senior Market Research Analyst Interview,No Offer,Neutral Experience,Average Interview,I applied online. I interviewed at FedEx.,Application,What is my role in previous. company?   Answer Question
"Jun 14, 2018","Anonymous Interview Candidate in Gardena, CA",Import Coordinator Interview,Declined Offer,Negative Experience,,"I applied online. The process took 4+ weeks. I interviewed at FedEx (Gardena, CA) in May 2018.",Application,Tell me about your school?   Answer Question
"Jun 7, 2018","Anonymous Employee in Portland, OR",Part Time Package Handler Interview,Accepted Offer,Positive Experience,Easy Interview,"I applied online. I interviewed at FedEx (Portland, OR) in October 2015.",Application,Why would you be good for this job   Answer Question
"Jun 1, 2018","Anonymous Interview Candidate in Pittsburgh, PA",Finance Co-Op Interview,No Offer,Positive Experience,Average Interview,"I applied online. I interviewed at FedEx (Pittsburgh, PA).",Application,Tell me a time when you had a challenge with you team; how you dealt with it.   Answer Question
"May 30, 2018","Anonymous Employee in Stamford, CT",Part Time Package Handler Interview,Accepted Offer,Negative Experience,Easy Interview,"I applied online. The process took 3 days. I interviewed at FedEx (Stamford, CT) in May 2018.",Application,If you can do the job   1 Answer
"May 26, 2018",Anonymous Employee,Junior Software Developer Interview,Accepted Offer,Positive Experience,Easy Interview,I applied online. The process took 4+ weeks. I interviewed at FedEx.,Application,Name a time when you did this/that type questions.   2 Answers
"May 21, 2018","Anonymous Interview Candidate in Plano, TX",Legal Specialist Interview,Declined Offer,Negative Experience,Difficult Interview,"I applied online. The process took 6 weeks. I interviewed at FedEx (Plano, TX) in January 2018.",Application,Why do you want to work for FedEx?   1 Answer
"May 16, 2018","Anonymous Interview Candidate in New York, NY",Part Time Package Handler Interview,Declined Offer,Neutral Experience,Easy Interview,"The process took 1+ week. I interviewed at FedEx (New York, NY).",Application,Do you accept this part time position for a minimum of 20 hours a week?   2 Answers
"May 16, 2018",Anonymous Employee,Hgv Driver Interview,Accepted Offer,Neutral Experience,Easy Interview,I applied online. I interviewed at FedEx.,Application,When are you available?   1 Answer
"May 10, 2018","Anonymous Employee in Memphis, TN",Senior Customer Account Services Agent Interview,Accepted Offer,Positive Experience,Average Interview,"I applied online. The process took 4+ weeks. I interviewed at FedEx (Memphis, TN) in June 2017.",Application,Describe a time you helped a customer solve a problem? what was your soultion?   Answer Question
"May 8, 2018",Anonymous Employee,Advisor Interview,Accepted Offer,Positive Experience,Average Interview,I applied online. I interviewed at FedEx.,Application,
"May 4, 2018","Anonymous Interview Candidate in Bellevue, WA",Software Developer Interview,No Offer,Negative Experience,Easy Interview,"I applied online. I interviewed at FedEx (Bellevue, WA) in April 2018.",Application,"Deployment Steps on Pivotal Cloud Foundry.
Data-binding and decorators.
Spring -boot advantages   Answer Question"
"Apr 30, 2018",Anonymous Interview Candidate,Internship Interview,No Offer,Neutral Experience,Average Interview,"The entire process took about 30 minutes or so. I interviewed years ago. asked to describe each project on the resume, describe the usage of each software that listed on resume.",Application,as described above   Answer Question
"Apr 30, 2018","Anonymous Employee in Colorado Springs, CO",Part Time Package Handler Interview,Accepted Offer,Positive Experience,Average Interview,"I applied online. The process took 1 day. I interviewed at FedEx (Colorado Springs, CO) in June 2017.",Application,"Are you capable of lifting 50 pounds almost constantly, and up to 150 pounds occasionally?   1 Answer"
"Apr 29, 2018","Anonymous Interview Candidate in Atlanta, GA",Assistant Manager Interview,No Offer,Negative Experience,Average Interview,"I applied online. The process took 4 days. I interviewed at FedEx (Atlanta, GA) in March 2018.",Application,Tell me about your management experience? Why did you leave your previous employer?   Answer Question
"Apr 26, 2018",Anonymous Interview Candidate,Driver Interview,Declined Offer,Positive Experience,Easy Interview,I applied in-person. I interviewed at FedEx.,Application,Are you a people person   1 Answer
"Apr 25, 2018","Anonymous Employee in New York, NY",Package Handler Interview,Accepted Offer,Positive Experience,Easy Interview,The interview was very short and simple. I was asked how I would handle conciliar with a fellow employee and if I was willing to do the work. They talked about the job and scheduled me for an orientation the following day. However they have rescheduled that orientation but I hope to start soon,Application,How would you handle conflict in the work place ?   Answer Question
"Apr 25, 2018",Anonymous Employee,IT Interview,Accepted Offer,Positive Experience,Easy Interview,I applied online. I interviewed at FedEx in January 2017.,Application,Tell me a time you suggested a great idea and it worked out   Answer Question
"Apr 24, 2018",Anonymous Interview Candidate,Customer Assistant Interview,No Offer,Positive Experience,Difficult Interview,I applied online. The process took 4 weeks. I interviewed at FedEx.,Application,can you lift 45lbs?   Answer Question
"Apr 23, 2018","Anonymous Employee in Hayward, CA",Part Time Package Handler Interview,Accepted Offer,Positive Experience,Average Interview,"I applied through an employee referral. The process took 2 weeks. I interviewed at FedEx (Hayward, CA) in April 2018.",Application,How do you handle conflict?   1 Answer
"Apr 23, 2018","Anonymous Employee in Irving, TX",IT Interview,Accepted Offer,Positive Experience,Difficult Interview,"I applied online. The process took a week. I interviewed at FedEx (Irving, TX) in January 2018.",Application,Tell me about a situation when you wanted to implement something new your organization and what steps you took if any to do so.   Answer Question
"Apr 21, 2018","Anonymous Employee in Indianapolis, IN",Courier Interview,Accepted Offer,Positive Experience,Easy Interview,"I applied online. I interviewed at FedEx (Indianapolis, IN) in May 2014.",Application,How can you make this company better.   1 Answer
"Apr 20, 2018","Anonymous Interview Candidate in New York, NY",Sales Specialist Interview,No Offer,Neutral Experience,Average Interview,"The process took 7+ weeks. I interviewed at FedEx (New York, NY) in February 2018.",Application,Tell me what you know about Fedex   Answer Question
"Apr 16, 2018","Anonymous Interview Candidate in Nashville, TN",Senior Software Engineer Interview,No Offer,Negative Experience,Easy Interview,"I applied online. The process took 1 day. I interviewed at FedEx (Nashville, TN) in March 2018.",Application,What would you do if business made a decision which had significant impact on your position.   Answer Question
"Apr 15, 2018","Anonymous Employee in Lakeland, FL",Customer Service Interview,Accepted Offer,Positive Experience,Easy Interview,"I applied online. The process took 4+ weeks. I interviewed at FedEx (Lakeland, FL) in March 2018.",Application,They interviewed in a behavioral style.   1 Answer
"Apr 12, 2018",Anonymous Interview Candidate,IT Manager Interview,No Offer,Negative Experience,Easy Interview,I applied online. The process took 4+ months. I interviewed at FedEx in February 2018.,Application,"What experience do you have managing a cyber security team,   Answer Question"
"Apr 10, 2018","Anonymous Interview Candidate in Omaha, NE",Account Executive Interview,No Offer,Negative Experience,Easy Interview,"I applied online. The process took 2 weeks. I interviewed at FedEx (Omaha, NE) in February 2018.",Application,Tell me about yourself...   Answer Question
"Apr 9, 2018","Anonymous Employee in Memphis, TN",Account Executive Interview,Accepted Offer,Positive Experience,Average Interview,"I applied online. The process took 3 weeks. I interviewed at FedEx (Memphis, TN) in January 2017.",Application,Name a time you have successfully brought on new business   1 Answer
"Apr 5, 2018","Anonymous Employee in Tracy, CA",Fedex Ground Package Handler Interview,Accepted Offer,Positive Experience,Easy Interview,"I applied online. The process took 2 weeks. I interviewed at FedEx (Tracy, CA) in April 2018.",Application,How do you handle conflict with someone or a argument ?   1 Answer
"Apr 5, 2018",Anonymous Interview Candidate in Petaling Jaya (Malaysia),Customer Service Representative Interview,No Offer,Negative Experience,Average Interview,I applied online. The process took 1 day. I interviewed at FedEx (Petaling Jaya (Malaysia)) in April 2018.,Application,What can I contribute and why choose fedex?   Answer Question
"Mar 28, 2018","Anonymous Interview Candidate in New York, NY",Package Handler Interview,No Offer,Positive Experience,,"I applied online. The process took 4+ weeks. I interviewed at FedEx (New York, NY) in March 2018.",Application,what hours are you willing to work?   Answer Question
"Mar 24, 2018","Anonymous Interview Candidate in Memphis, TN",Analyst Interview,No Offer,Negative Experience,Easy Interview,"I applied online. I interviewed at FedEx (Memphis, TN) in January 2018.",Application,Basic bhavioral questions.   Answer Question
"Mar 22, 2018","Anonymous Interview Candidate in Pittsburgh, PA",Route Driver Interview,No Offer,Neutral Experience,Easy Interview,"I applied online. The process took 3 days. I interviewed at FedEx (Pittsburgh, PA) in March 2018.",Application,How many years of experience do you have if any as a driver for a verifiable business. (if its less than 12 months then you are disqualified)   3 Answers
"Mar 22, 2018","Anonymous Employee in Ocala, FL",Part Time Package Handler Interview,Accepted Offer,Positive Experience,Easy Interview,"I applied online. The process took 2 weeks. I interviewed at FedEx (Ocala, FL) in November 2017.",Application,"They asked me if i wanted the job, and if i could lift 40 pounds unassisted.   1 Answer"
"Mar 20, 2018","Anonymous Employee in Rochester, NY",Revenue Management Analyst Interview,Accepted Offer,Positive Experience,Average Interview,"I applied online. I interviewed at FedEx (Rochester, NY) in January 2018.",Application,basic behavioral questions   Answer Question
"Mar 16, 2018","Anonymous Employee in Charlotte, NC",Part Time Package Handler Interview,Accepted Offer,Positive Experience,Easy Interview,"I applied online. The process took 3 weeks. I interviewed at FedEx (Charlotte, NC) in February 2018.",Application,How would you handle a situation where you get into a disagreement with a fellow employee   1 Answer
"Mar 13, 2018","Anonymous Employee in Vancouver, BC (Canada)",Logistics Specialist Interview,Accepted Offer,Positive Experience,Average Interview,"I applied through an employee referral. The process took 3 weeks. I interviewed at FedEx (Vancouver, BC (Canada)) in December 2015.",Application,Brief my working experience   Answer Question
"Mar 13, 2018","Anonymous Interview Candidate in Memphis, TN",Marketing Specialist Interview,No Offer,Positive Experience,Average Interview,"I applied online. I interviewed at FedEx (Memphis, TN) in February 2018.",Application,Tell me about a time you used complex information to solve a problem with a quick turnaround time.   Answer Question
"Mar 12, 2018","Anonymous Employee in Rochester, NY",FAE Interview,Accepted Offer,Negative Experience,Easy Interview,"I applied online. The process took 2 weeks. I interviewed at FedEx (Rochester, NY) in January 2014.",Application,what is your reason to work here   1 Answer
"Mar 11, 2018",Anonymous Interview Candidate,Marketing Manager Interview,No Offer,Neutral Experience,Difficult Interview,"CHAM Test took about 2-3 hours which comprised of Mathematical test, critical reading test,some logic tests. There is also a test to read how many boxes in each picture which took about 10 minutes. There is also attitude and personality test, in which took about 1 hour.",Application,CHAM Test   Answer Question
"Mar 6, 2018","Anonymous Employee in Toronto, ON (Canada)",Engineer Interview,Accepted Offer,Positive Experience,Average Interview,"I applied online. The process took 3 weeks. I interviewed at FedEx (Toronto, ON (Canada)) in January 2016.",Application,What is your greatest strength?   1 Answer
"Mar 5, 2018","Anonymous Interview Candidate in Washington, DC",IT Interview,No Offer,Positive Experience,Average Interview,"I applied online. The process took 4 weeks. I interviewed at FedEx (Washington, DC) in December 2017.",Application,Tell about a time when you took leads on a project.   2 Answers
"Mar 4, 2018","Anonymous Employee in Montreal, QC (Canada)",agent au centre d'expédition Interview,Accepted Offer,Positive Experience,Easy Interview,"I applied online. The process took 3 weeks. I interviewed at FedEx (Montreal, QC (Canada)) in December 2016.",Application,Pourquoi voulez vous travailler chez Fedex?   2 Answers
"Feb 24, 2018",Anonymous Employee,Material Handler Interview,Accepted Offer,Positive Experience,Easy Interview,I applied online. The process took 5 days. I interviewed at FedEx in February 2018.,Application,Do you have reliable transportation?   Answer Question
"Feb 19, 2018",Anonymous Interview Candidate in Bengaluru (India),Legal Interview,No Offer,Negative Experience,Easy Interview,I applied through a recruiter. The process took 1 day. I interviewed at FedEx (Bengaluru (India)) in November 2017.,Application,How would you review specific agreement?   1 Answer
"Feb 16, 2018",Anonymous Employee,Inside Sales Account Executive Interview,Accepted Offer,Positive Experience,Difficult Interview,I applied online. The process took 4+ weeks. I interviewed at FedEx in February 2018.,Application,Tell me about a time when...   Answer Question
"Feb 6, 2018","Anonymous Interview Candidate in Dallas, TX",Marketing and Communications Interview,No Offer,Positive Experience,Average Interview,"I applied online. The process took 1 day. I interviewed at FedEx (Dallas, TX) in December 2017.",Application,About FedEx   1 Answer
"Feb 6, 2018",Anonymous Employee,ECO Import Coordinator Interview,Accepted Offer,Positive Experience,Average Interview,I applied online. The process took 4 weeks. I interviewed at FedEx.,Application,describe a time you had a conflict you had to handle?   1 Answer
"Feb 5, 2018","Anonymous Employee in Lexington, KY",Operations Coordinator Interview,Accepted Offer,Negative Experience,Average Interview,"I applied online. The process took a week. I interviewed at FedEx (Lexington, KY) in August 2014.",Application,How would you handle a upset customer?   1 Answer
