Date,Location,Job,Offer_Decision,Experience,Interview_Diff,Application_Text,Interview_Text,InterviewQs
"Mar 30, 2020",Anonymous Employee,Package Handler Interview,Accepted Offer,Positive Experience,Easy Interview,I applied online. I interviewed at FedEx.,Application,Can you lift up to 100 pounds l?   2 Answers
"Mar 27, 2020",Anonymous Interview Candidate,Intern Interview,No Offer,Neutral Experience,Average Interview,I applied online. I interviewed at FedEx.,Application,Tell me about a time when you held someone who did not contribute in the team accountable   1 Answer
"Mar 27, 2020",Anonymous Employee,Operations Administrator Interview,Accepted Offer,Negative Experience,Difficult Interview,I applied through college or university. I interviewed at FedEx.,Application,Asked in the BAR method - tell us about a time when you had an argument with someone in the workplace   1 Answer
"Mar 18, 2020","Anonymous Employee in San Francisco, CA",Part Time Package Handler Interview,Accepted Offer,Positive Experience,Easy Interview,"I applied through a recruiter. The process took 1 day. I interviewed at FedEx (San Francisco, CA) in March 2019.",Application,Would you like to be scheduled for a drug test?   1 Answer
"Mar 8, 2020","Anonymous Interview Candidate in New York, NY",Driver Interview,Declined Offer,Positive Experience,Easy Interview,"I applied through a staffing agency. I interviewed at FedEx (New York, NY) in March 2020.",Application,"He asking, about were are you asked   1 Answer"
"Mar 5, 2020",Anonymous Employee,Marketing Principal Interview,Accepted Offer,Positive Experience,Average Interview,It was an in person panel interview with 3 managers who asked 8 behavioral questions. Two of the questions were related to conflict. Surprisingly there were no questions related the product marketing area that the position was in.,Application,Tell me about a time when you had to make a decision without all the information?   Answer Question
"Mar 5, 2020","Anonymous Employee in São Paulo, São Paulo (Brazil)",Agente De Atendimento Bilingue Interview,Accepted Offer,Neutral Experience,Average Interview,"I applied through an employee referral. The process took 2 days. I interviewed at FedEx (São Paulo, São Paulo (Brazil)).",Application,"""O que você sabe sobre a empresa?""
""O que você faria em x situação?""   Answer Question"
"Mar 4, 2020","Anonymous Employee in Memphis, TN",Data Scientist Interview,Accepted Offer,Positive Experience,Easy Interview,"I applied online. The process took 3 weeks. I interviewed at FedEx (Memphis, TN) in January 2019.",Application,Spoke about experiences and projects on resume   Answer Question
"Mar 2, 2020",Anonymous Interview Candidate,Intern - Hourly Interview,Declined Offer,Neutral Experience,,Behavioral interview. It was a virtual interview and I was asked various questions about the company and my own experience. My programming experience and how it can influence the company.,Application,Contribution   Answer Question
"Mar 1, 2020",Anonymous Interview Candidate in Kempton Park (South Africa),Graduate Interview,No Offer,Positive Experience,Average Interview,I applied online. The process took 3+ months. I interviewed at FedEx (Kempton Park (South Africa)) in January 2020.,Application,"Give a situation where you had to solve a problem, in a group.   Answer Question"
"Feb 25, 2020",Anonymous Interview Candidate,Internship Interview,No Offer,Neutral Experience,Average Interview,"Sales Internship. Applied online, was contacted about 2 weeks later to schedule a video interview. 2 on 1 with classic behavioral questions. Interviewers were pretty dry but nice poeple.",Interview,Why FedEx?   Answer Question
"Feb 22, 2020",Anonymous Interview Candidate in Amsterdam (Netherlands),Senior Platform Engineer Interview,Declined Offer,Negative Experience,Easy Interview,The process took 2+ months. I interviewed at FedEx (Amsterdam (Netherlands)).,Interview,Asked about professional experiences   Answer Question
"Feb 17, 2020","Anonymous Interview Candidate in Memphis, TN",Director of Sales Interview,No Offer,Positive Experience,Difficult Interview,"I applied in-person. I interviewed at FedEx (Memphis, TN) in October 2019.",Interview,What does coaching mean to you   Answer Question
"Feb 16, 2020","Anonymous Employee in Memphis, TN",Technical Support Representative Interview,Accepted Offer,Positive Experience,Easy Interview,"I applied online. I interviewed at FedEx (Memphis, TN) in February 2020.",Interview,Have you ever disagreed with some type of change at work and how did you handle it?   1 Answer
"Feb 14, 2020",Anonymous Employee,Customer Service Manager Interview,Accepted Offer,Neutral Experience,Easy Interview,I applied online. The process took 2 weeks. I interviewed at FedEx in March 2018.,Interview,Describe a situation when I had a difficult employee and how I handled it.   Answer Question
"Feb 10, 2020","Anonymous Employee in Bell, CA",Part Time Package Handler Interview,Accepted Offer,Positive Experience,Easy Interview,"I applied online. The process took a week. I interviewed at FedEx (Bell, CA) in August 2019.",Interview,Where do you see yourself in 5 years?   Answer Question
"Feb 9, 2020","Anonymous Interview Candidate in Hutchins, TX",Ops Manager Interview,No Offer,Neutral Experience,Average Interview,"I applied online. The process took a week. I interviewed at FedEx (Hutchins, TX) in February 2020.",Interview,BARS Interview which is basically the same as STAR interview.   1 Answer
"Feb 9, 2020",Anonymous Employee,Business Inside Sales Account Executive Interview,Accepted Offer,Positive Experience,,I was found by a recruiter via Linkedin and she scheduled a video interview just to tell me about the job and to understand my current position. I was told to then apply for the job so she could set up my next interview which i believe was 2 managers over the position but from 2 separate teams. They asked situational questions and wanted to know what would/have you done in a particular situation. After interview i was told that i would hear something in about a week. Ended up receiving the offer the next morning and accepted!,Interview,Give me a time when you had an unhappy customer because of a mistake you did. How would/did you handle this situation?   2 Answers
"Feb 7, 2020",Anonymous Employee in Singapore (Singapore),Accounting Assistant Interview,Accepted Offer,Positive Experience,Average Interview,I applied online. The process took 3 days. I interviewed at FedEx (Singapore (Singapore)).,Interview,Specify balance sheet and P/L?   Answer Question
"Feb 7, 2020",Anonymous Employee,Intern Interview,Accepted Offer,Positive Experience,Average Interview,I applied online. The process took 2 days. I interviewed at FedEx in January 2018.,Interview,Tell me about a time that you used data to influence a team's decision.   Answer Question
"Feb 1, 2020","Anonymous Employee in Exton, PA",Part Time Package Handler Interview,Accepted Offer,Neutral Experience,Easy Interview,"I applied online. The process took a week. I interviewed at FedEx (Exton, PA) in September 2019.",Application,
"Jan 28, 2020","Anonymous Employee in Muncy, PA",Part Time Package Handler Interview,Accepted Offer,Positive Experience,Easy Interview,"I applied online. The process took a week. I interviewed at FedEx (Muncy, PA) in December 2018.",Application,Where do you live?   1 Answer
"Jan 21, 2020","Anonymous Employee in Herndon, VA",Loader Interview,Accepted Offer,Neutral Experience,Easy Interview,"I applied online. The process took 4+ weeks. I interviewed at FedEx (Herndon, VA) in February 2019.",Application,there was no interview question except when your available   Answer Question
"Jan 19, 2020",Anonymous Employee,Material Handler Interview,Accepted Offer,Positive Experience,Easy Interview,I applied online. The process took 3 days. I interviewed at FedEx in December 2019.,Application,Are you physically capable of the strenuous work?   Answer Question
"Jan 18, 2020",Anonymous Interview Candidate,Inside Sales Representative Interview,Declined Offer,Positive Experience,Average Interview,The interview process was good. Both the interviewers were experienced team members. The interview was scheduled in Dwarka office. Though it was a long process as number of candidates were 7-10 still they managed to wrap up the process within one day and results were announced the next day over email.,Application,I was asked to sell any product to them to check my selling and convincing skills.   Answer Question
"Jan 15, 2020","Anonymous Employee in Memphis, TN",Manager Interview,Accepted Offer,Neutral Experience,Difficult Interview,"I applied online. The process took 3+ months. I interviewed at FedEx (Memphis, TN) in October 2018.",Application,Tell me about a time you have to deal with a very difficult customer.   Answer Question
"Jan 14, 2020","Anonymous Employee in Lima, Lima Region (Peru)",Project Management Support Trainee Interview,Accepted Offer,Positive Experience,Average Interview,"I applied online. The process took a week. I interviewed at FedEx (Lima, Lima Region (Peru)) in August 2019.",Application,¿Como resolverías el caso?   Answer Question
"Jan 12, 2020","Anonymous Employee in Boise, ID",Package Handler Interview,Accepted Offer,Positive Experience,Easy Interview,"I applied online. The process took 2 weeks. I interviewed at FedEx (Boise, ID) in February 2019.",Application,Can you lift 70 lbs?   1 Answer
"Jan 9, 2020","Anonymous Employee in São Paulo, São Paulo (Brazil)",Analista Pleno Interview,Accepted Offer,Positive Experience,Average Interview,"I applied through an employee referral. The process took a week. I interviewed at FedEx (São Paulo, São Paulo (Brazil)) in April 2016.",Application,Toda experiência profissional   Answer Question
"Jan 8, 2020","Anonymous Employee in Chicago, IL",Truck Driver Interview,Accepted Offer,Positive Experience,Easy Interview,"I applied online. The process took 3 weeks. I interviewed at FedEx (Chicago, IL) in July 2018.",Application,what other jobs have you worked in?   Answer Question
"Jan 6, 2020",Anonymous Employee,Sales Executive Interview,Accepted Offer,Positive Experience,Difficult Interview,I applied online. The process took 3 weeks. I interviewed at FedEx.,Application,Typical behavioral and how you sell and quantify value.   Answer Question
"Jan 2, 2020",Anonymous Interview Candidate,Intern Marketing Interview,No Offer,Negative Experience,Difficult Interview,I applied through college or university. The process took 3+ months. I interviewed at FedEx in November 2019.,Application,"1. How did you prepare for this interview?
2. What do you know about FedEx? (wish I had known about how they avoided taxes and didn't reinvest their tax breaks prior to the interview)
3. Four negative experience behavioral questions   Answer Question"
"Dec 25, 2019","Anonymous Employee in Charlotte, NC",Operations P&D Interview,Accepted Offer,Positive Experience,Difficult Interview,"I applied in-person. The process took 4 weeks. I interviewed at FedEx (Charlotte, NC).",Application,Describe a time you had to resolve an issue with someone of a different opinion than mine.   Answer Question
"Dec 18, 2019",Anonymous Interview Candidate,Package Handler Interview,No Offer,Neutral Experience,,I applied online. I interviewed at FedEx in December 2019.,Application,Time and availability   1 Answer
"Dec 10, 2019",Anonymous Interview Candidate,IT Business Analyst Interview,No Offer,Negative Experience,Easy Interview,I applied online. The process took 4+ months. I interviewed at FedEx.,Application,"Past work experience, academic projects, etc.   Answer Question"
"Dec 10, 2019",Anonymous Interview Candidate,Package Handler Interview,No Offer,Positive Experience,Easy Interview,I applied online. The process took 5 days. I interviewed at FedEx.,Application,Do you think you can perform the physical job?   Answer Question
"Dec 9, 2019",Anonymous Interview Candidate,Livreur Interview,No Offer,Negative Experience,Average Interview,I applied through other source. I interviewed at FedEx.,Application,Behavioral interview   1 Answer
"Dec 5, 2019",Anonymous Employee,Package Handler Interview,Accepted Offer,Positive Experience,Easy Interview,They accidentally called my phone and thought I was someone else when scheduling the interview. Interview started off really awkward but went well. Because it is such a low income and the hours are very unusual it is not hard to get hired,Application,Do i have means of transportation? Can i be there everyday at 3am?   2 Answers
"Nov 29, 2019",Anonymous Employee,Deli Clerk Interview,Accepted Offer,Positive Experience,Easy Interview,I applied in-person. I interviewed at FedEx.,Application,how many can u do on avg   Answer Question
"Nov 29, 2019",Anonymous Interview Candidate in Indore (India),Territory Manager Interview,No Offer,Positive Experience,Difficult Interview,I interviewed at FedEx (Indore (India)) in October 2019.,Application,Are you comfortable in sales bcoz u r a girl and this is hardcore sales profile   1 Answer
"Nov 27, 2019","Anonymous Employee in São Paulo, São Paulo (Brazil)",Agente De Atendimento Interview,Accepted Offer,Positive Experience,Easy Interview,"I applied through an employee referral. I interviewed at FedEx (São Paulo, São Paulo (Brazil)) in November 2015.",Application,Não me lembro   1 Answer
"Nov 25, 2019","Anonymous Employee in Dallas, TX",Package Handler Interview,Accepted Offer,Positive Experience,Easy Interview,"I applied online. The process took a week. I interviewed at FedEx (Dallas, TX) in November 2019.",Application,What was the reasoning you applied?   1 Answer
"Nov 25, 2019","Anonymous Interview Candidate in Tracy, CA",Area Manager Interview,No Offer,Negative Experience,Average Interview,"I applied online. The process took 4 weeks. I interviewed at FedEx (Tracy, CA) in September 2019.",Application,Focused primarily on behavioral questions   Answer Question
"Nov 24, 2019",Anonymous Employee,Package Handler Interview,Accepted Offer,Positive Experience,Easy Interview,I applied in-person. I interviewed at FedEx.,Application,What would you do if the was a quarrel between coworkers.   1 Answer
"Nov 19, 2019",Anonymous Employee,Material Handler Interview,Accepted Offer,Positive Experience,Easy Interview,I applied in-person. I interviewed at FedEx.,Application,Do you believe in delivering the Purple Promise?   Answer Question
"Nov 19, 2019","Anonymous Employee in Prescott, AZ",Part Time Package Handler Interview,Accepted Offer,Positive Experience,Easy Interview,"I applied online. The process took 1 day. I interviewed at FedEx (Prescott, AZ) in November 2019.",Application,How do you manage conflict   Answer Question
"Nov 11, 2019","Anonymous Employee in Columbus, OH",Part Time Package Handler Interview,Accepted Offer,Positive Experience,Easy Interview,"I applied online. The process took 2 days. I interviewed at FedEx (Columbus, OH) in November 2019.",Application,If i could handle the building temperature.   1 Answer
"Nov 11, 2019",Anonymous Employee,Software Developer Interview,Accepted Offer,Negative Experience,Easy Interview,I applied online. The process took 4+ months. I interviewed at FedEx in August 2019.,Application,"REST web services, CI/CD, deployment process, cloud   Answer Question"
"Oct 29, 2019","Anonymous Employee in Louisville, KY",Delivery Driver Interview,Accepted Offer,Positive Experience,Average Interview,"I applied online. The process took 2 weeks. I interviewed at FedEx (Louisville, KY) in October 2019.",Application,Driving experience and background check   Answer Question
"Oct 28, 2019","Anonymous Employee in Richmond, VA",Package Handler Interview,Accepted Offer,Neutral Experience,Easy Interview,"I applied online. The process took 1+ week. I interviewed at FedEx (Richmond, VA) in May 2018.",Application,Do I have reliable transportation   1 Answer
"Oct 15, 2019",Anonymous Interview Candidate,Payroll Analyst Interview,No Offer,Neutral Experience,,I applied online. I interviewed at FedEx in August 2019.,Application,Tell me something about yourself   Answer Question
"Oct 15, 2019",Anonymous Employee in Kuala Lumpur (Malaysia),Customer Service Representative Interview,Accepted Offer,Positive Experience,Average Interview,I applied through a recruiter. I interviewed at FedEx (Kuala Lumpur (Malaysia)).,Application,describe your self   Answer Question
"Oct 14, 2019","Anonymous Employee in Memphis, TN",Marketing Specialist Advisor Interview,Accepted Offer,Positive Experience,Average Interview,"I applied in-person. The process took 3 weeks. I interviewed at FedEx (Memphis, TN).",Application,Almost all work situations will require us at some point to interact with someone that we dislike. Describe a situation that you have encountered like this and explain how you handled it.   Answer Question
"Oct 11, 2019","Anonymous Interview Candidate in San Antonio, TX",Operations Manager Interview,No Offer,Positive Experience,Average Interview,"I applied online. The process took 2 weeks. I interviewed at FedEx (San Antonio, TX) in September 2019.",Application,BARS interview structure   Answer Question
"Oct 4, 2019","Anonymous Interview Candidate in Oxford, MS",Intern Interview,Declined Offer,Positive Experience,Average Interview,"I applied through college or university. The process took 5 weeks. I interviewed at FedEx (Oxford, MS) in October 2019.",Application,Tell us about a time you solved a conflict with a customer or team member   Answer Question
"Oct 1, 2019","Anonymous Employee in Lewisberry, PA",Package Handler Interview,Accepted Offer,Positive Experience,Easy Interview,"I applied online. The process took 2 days. I interviewed at FedEx (Lewisberry, PA) in March 2019.",Application,How would you handle a conflict in the workplace?   Answer Question
"Sep 19, 2019",Anonymous Interview Candidate in Rodez (France),Livreur Interview,No Offer,Positive Experience,Easy Interview,I applied in-person. The process took 2+ weeks. I interviewed at FedEx (Rodez (France)) in August 2016.,Application,Avez vous de l'expérience dans le domaine.   Answer Question
"Sep 14, 2019","Anonymous Interview Candidate in New York, NY",Package Handler Interview,No Offer,Positive Experience,Average Interview,"I applied in-person. The process took 3 days. I interviewed at FedEx (New York, NY) in September 2019.",Application,can i see myself doing this job   2 Answers
"Sep 14, 2019","Anonymous Employee in Greensboro, NC",Part Time Package Handler Interview,Accepted Offer,Neutral Experience,Easy Interview,"I applied online. The process took 4+ weeks. I interviewed at FedEx (Greensboro, NC) in June 2019.",Application,Are you able to move packages up to 70lbs   1 Answer
"Sep 9, 2019","Anonymous Interview Candidate in Phoenix, AZ",Inside Sales Account Executive Interview,No Offer,Neutral Experience,Average Interview,"I applied through an employee referral. The process took 6+ months. I interviewed at FedEx (Phoenix, AZ) in August 2019.",Application,Describe a time in which you were able to sway/convince a potential client who was hesitant to buy.   Answer Question
"Sep 9, 2019","Anonymous Interview Candidate in Atlanta, GA",Delivery Driver Interview,Declined Offer,Positive Experience,Easy Interview,"I applied through an employee referral. I interviewed at FedEx (Atlanta, GA) in September 2019.",Application,
"Sep 5, 2019","Anonymous Interview Candidate in Oklahoma City, OK",Fed Ex Ground Package Handler Interview,Declined Offer,Negative Experience,Easy Interview,"I applied online. The process took 2 days. I interviewed at FedEx (Oklahoma City, OK).",Application,Why did you leave your last job?   1 Answer
"Sep 3, 2019",Anonymous Employee,CSR Interview,Accepted Offer,Neutral Experience,Average Interview,I applied online. The process took 4 weeks. I interviewed at FedEx in January 2015.,Application,Name a time where you had to deal with a difficult customer   1 Answer
"Aug 30, 2019","Anonymous Employee in Memphis, TN",Package Handler Interview,Accepted Offer,Positive Experience,Easy Interview,"I applied online. The process took a week. I interviewed at FedEx (Memphis, TN) in September 2018.",Application,"Do you have anything on your record?
Basic questions.   1 Answer"
"Aug 25, 2019","Anonymous Interview Candidate in New York, NY",Engineer Interview,Declined Offer,Negative Experience,Difficult Interview,"I applied online. The process took 4+ weeks. I interviewed at FedEx (New York, NY) in August 2019.",Application,"List the start date, end date, employer, title, FedEx affiliation, country, state, city, address, zip code, phone number, supervisor, contact preference, FMCSAR medical card, FMCSAR drug test, reason for leaving, responsibilities, and volunteer experience for every single company you've worked for in the past ten years.   1 Answer"
"Aug 24, 2019","Anonymous Interview Candidate in Pittsburgh, PA",Customer Service Representative Interview,Declined Offer,Neutral Experience,Average Interview,"I applied through other source. I interviewed at FedEx (Pittsburgh, PA).",Application,What would you do if you had a problem with a customer and what is the outcome. How did you make a customer happy etc.   Answer Question
"Aug 13, 2019","Anonymous Employee in Memphis, TN",Marketing Specialist Interview,Accepted Offer,Positive Experience,Average Interview,"I applied online. I interviewed at FedEx (Memphis, TN) in January 2017.",Application,"Tell me about yourself
Tell me about a time you had to choose between two decisions/alternatives?
Tell me about a time you had to work with a difficult team member   Answer Question"
"Aug 8, 2019","Anonymous Employee in Atlanta, GA",Dispatcher Interview,Accepted Offer,Positive Experience,Easy Interview,"I applied online. I interviewed at FedEx (Atlanta, GA) in January 2018.",Application,What type of candy would I be and why. Wasn't expecting that.   Answer Question
"Aug 7, 2019","Anonymous Employee in Fargo, ND",Part Time Package Handler Interview,Accepted Offer,Positive Experience,Easy Interview,"I applied online. The process took 5 days. I interviewed at FedEx (Fargo, ND) in January 2018.",Application,How would you describe your work ethic   1 Answer
"Aug 2, 2019",Anonymous Interview Candidate,Software Engineer Interview,No Offer,Negative Experience,Average Interview,I applied online. I interviewed at FedEx.,Application,Tell me about your experience in the past where you developed a solution for immediate problem where that solution was also used in the long run   1 Answer
"Aug 1, 2019","Anonymous Employee in Dallas, TX",District Sales Manager Interview,Accepted Offer,Positive Experience,Difficult Interview,"I applied through an employee referral. The process took 3+ months. I interviewed at FedEx (Dallas, TX) in October 2018.",Application,Tell me a time when...   2 Answers
"Jul 31, 2019","Anonymous Employee in Macon, GA",Courier Interview,Accepted Offer,Positive Experience,Average Interview,"I applied online. The process took 2+ months. I interviewed at FedEx (Macon, GA) in September 2018.",Application,Behavioral questions   1 Answer
"Jul 29, 2019",Anonymous Employee in Colombo (Sri Lanka),Accounting Manager Interview,Accepted Offer,Positive Experience,Average Interview,I applied online. The process took 5 days. I interviewed at FedEx (Colombo (Sri Lanka)) in February 2019.,Application,"1.tell me about yourself
2.My past experience,roles and responsibilities
3.problem solving questions   1 Answer"
"Jul 26, 2019","Anonymous Interview Candidate in Atlanta, GA",Customer Service Representative Interview,Declined Offer,Negative Experience,Easy Interview,"I applied online. The process took 2 days. I interviewed at FedEx (Atlanta, GA) in July 2019.",Application,What is a common misconception people make about you?   2 Answers
"Jul 25, 2019","Anonymous Employee in Olive Branch, MS",Part Time Package Handler Interview,Accepted Offer,Neutral Experience,Easy Interview,"I applied online. The process took 1 day. I interviewed at FedEx (Olive Branch, MS) in July 2019.",Application,
"Jul 24, 2019","Anonymous Employee in Washington, DC",Attorney Interview,Accepted Offer,Positive Experience,Difficult Interview,"I applied online. I interviewed at FedEx (Washington, DC) in February 2019.",Application,How will I relieve the stress of being a FedEx attorney   2 Answers
"Jul 23, 2019","Anonymous Employee in Saint Louis, MO",Part Time Package Handler Interview,Accepted Offer,Positive Experience,,"I applied online. The process took 2 weeks. I interviewed at FedEx (Saint Louis, MO) in July 2019.",Application,"Safety issues,   2 Answers"
"Jul 18, 2019",Anonymous Employee,Software Developer Interview,Accepted Offer,Neutral Experience,Easy Interview,"Talked about technical problems, low-level questions. Mostly behavioral questions. FedEx does have a hard interview process when I interviewed, but I think they are doing more code-based examples now.",Application,Talk about a time your solved a problem and what the result was.   Answer Question
"Jul 16, 2019",Anonymous Employee,Credit Controller Interview,Accepted Offer,Neutral Experience,Average Interview,I applied through other source. The process took 3 weeks. I interviewed at FedEx.,Application,Please describe the difficult situation you encountered and tell us how you handled it   Answer Question
"Jul 16, 2019","Anonymous Interview Candidate in London, England (UK)",Human Resources Assistant Interview,No Offer,Positive Experience,Average Interview,"I applied online. The process took 2 weeks. I interviewed at FedEx (London, England (UK)) in June 2019.",Application,They asked situational questions   Answer Question
