Date,Location,Job,Offer_Decision,Experience,Interview_Diff,Application_Text,Interview_Text,InterviewQs
"Feb 4, 2018","Anonymous Interview Candidate in Colorado Springs, CO",Software Developer Interview,Declined Offer,Positive Experience,Easy Interview,"I applied online. The process took a week. I interviewed at FedEx (Colorado Springs, CO).",Application,Tell us about a time when you had to shift priorities?   Answer Question
"Feb 2, 2018","Anonymous Employee in Chicago, IL",Part Time Package Handler Interview,Accepted Offer,Negative Experience,Easy Interview,"I applied online. The process took 1 day. I interviewed at FedEx (Chicago, IL) in October 2017.",Application,Can you lift 50 pounds   1 Answer
"Feb 1, 2018","Anonymous Employee in Irving, TX",Inside Sales Representative Interview,Accepted Offer,Positive Experience,Average Interview,"I applied online. The process took 2 weeks. I interviewed at FedEx (Irving, TX) in September 2014.",Application,"ex: Describe a moment when you had a difficult situation with a peer and how did you resolve it.
Describe a moment in your career when you dealt with a challenge and how did you manage it.
What do you consider a weakness_   Answer Question"
"Feb 1, 2018","Anonymous Interview Candidate in Blasdell, NY",Part Time Package Handler Interview,No Offer,Positive Experience,Easy Interview,"I applied in-person. I interviewed at FedEx (Blasdell, NY).",Application,They asked how handle disagreements.   1 Answer
"Feb 1, 2018","Anonymous Interview Candidate in Charlotte, NC",Part Time Package Handler Interview,No Offer,Positive Experience,Easy Interview,"I applied online. The process took a week. I interviewed at FedEx (Charlotte, NC) in January 2018.",Application,Can you lift a 100 pounds package ?   Answer Question
"Jan 29, 2018","Anonymous Employee in Memphis, TN",Material Handler Interview,Accepted Offer,Positive Experience,Easy Interview,"I applied online. The process took 3 days. I interviewed at FedEx (Memphis, TN) in January 2016.",Application,If I am willing and able to pass test   1 Answer
"Jan 26, 2018","Anonymous Employee in New York, NY",Sorter Interview,Accepted Offer,Positive Experience,Average Interview,"I applied through a staffing agency. I interviewed at FedEx (New York, NY) in November 2014.",Application,Can I twist and turn   1 Answer
"Jan 20, 2018","Anonymous Employee in Tacoma, WA",Part Time Package Handler Interview,Accepted Offer,Positive Experience,Easy Interview,"I applied online. The process took a week. I interviewed at FedEx (Tacoma, WA) in June 2017.",Application,Why did you leave your last job?   Answer Question
"Jan 19, 2018","Anonymous Interview Candidate in New York, NY",Import Coordinator Interview,Declined Offer,Neutral Experience,Difficult Interview,"I applied through other source. The process took 2+ months. I interviewed at FedEx (New York, NY) in March 2013.",Application,what type of person are you   1 Answer
"Jan 19, 2018",Anonymous Employee,Sales Interview,Accepted Offer,Positive Experience,Average Interview,I applied online. The process took 3 weeks. I interviewed at FedEx.,Application,Behavioral Questions   1 Answer
"Jan 19, 2018","Anonymous Interview Candidate in Snetterton, England (UK)",Operations Administrator Interview,No Offer,Negative Experience,Easy Interview,"I applied through a staffing agency. The process took a week. I interviewed at FedEx (Snetterton, England (UK)) in January 2018.",Application,Explain your current role   Answer Question
"Jan 18, 2018","Anonymous Interview Candidate in Dallas, TX",ECommerce Specialist Interview,No Offer,Negative Experience,Average Interview,"I applied through a recruiter. The process took 2 weeks. I interviewed at FedEx (Dallas, TX) in November 2017.",Application,general questions about my background and ecommerce environment.   1 Answer
"Jan 18, 2018","Anonymous Employee in Tyler, TX",Part Time Courier Interview,Accepted Offer,Positive Experience,Average Interview,"I applied through an employee referral. The process took a week. I interviewed at FedEx (Tyler, TX) in October 2013.",Application,How would you handle adversity   1 Answer
"Jan 16, 2018","Anonymous Employee in Baton Rouge, LA",Senior Service Agent Interview,Accepted Offer,Positive Experience,Easy Interview,"I applied online. The process took 4+ weeks. I interviewed at FedEx (Baton Rouge, LA) in August 2013.",Application,Name a time when you had to resolve a difficult issue for a customer   Answer Question
"Jan 10, 2018","Anonymous Employee in Memphis, TN",Marketing Associate Interview,Accepted Offer,Neutral Experience,Difficult Interview,"I applied online. The process took 3 weeks. I interviewed at FedEx (Memphis, TN).",Application,All questions were situational and asked what would you do in xyz scenario.   1 Answer
"Jan 10, 2018","Anonymous Employee in Dallas, TX",Revenue Management Interview,Accepted Offer,Positive Experience,Average Interview,"I applied online. I interviewed at FedEx (Dallas, TX) in January 2017.",Application,Was there a time that you committed a mistake and then corrected it before its impact on the organization?   Answer Question
"Jan 9, 2018","Anonymous Interview Candidate in Chicago, IL",Sales Interview,Declined Offer,Positive Experience,Average Interview,"I applied online. The process took 2+ months. I interviewed at FedEx (Chicago, IL) in December 2017.",Application,They asked me about one situation and how i solved it   Answer Question
"Jan 8, 2018",Anonymous Interview Candidate,Center Consultant Interview,Declined Offer,Neutral Experience,Difficult Interview,I applied online. I interviewed at FedEx.,Application,Name me a time when collaborated on something with a customer?   Answer Question
"Jan 5, 2018","Anonymous Employee in Richmond, BC (Canada)",Cargo Handler Interview,Accepted Offer,Positive Experience,Easy Interview,"I applied online. The process took 4 days. I interviewed at FedEx (Richmond, BC (Canada)) in June 2016.",Application,Whats your best attention to detail incident?   1 Answer
"Jan 5, 2018","Anonymous Employee in New York, NY",Intern - Hourly Interview,Accepted Offer,Positive Experience,Average Interview,"The process took 3+ months. I interviewed at FedEx (New York, NY).",Application,"Basic behavioral questions, answer using STAR   Answer Question"
"Jan 5, 2018","Anonymous Interview Candidate in Atlanta, GA",Sales Representative Interview,No Offer,Neutral Experience,Average Interview,"I applied online. The process took 4+ weeks. I interviewed at FedEx (Atlanta, GA) in December 2017.",Application,What do I know about Fed Ex?   Answer Question
"Jan 5, 2018",Anonymous Interview Candidate,Engineer Interview,No Offer,Positive Experience,Average Interview,"The interview process was very professional. They asked me the general questions such as ""why are you best for this position"" and ""talk about a time where you experienced conflict with a team""",Application,Why should we hire you?   Answer Question
"Dec 19, 2017","Anonymous Employee in Camden, NJ",Part Time Package Handler Interview,Accepted Offer,Positive Experience,Easy Interview,"I applied online. The process took a week. I interviewed at FedEx (Camden, NJ) in September 2017.",Application,Could I lift up to 100 lbs.   1 Answer
"Dec 15, 2017","Anonymous Interview Candidate in Naples, FL",Customer Service Associate Interview,No Offer,Positive Experience,Average Interview,"I applied online. I interviewed at FedEx (Naples, FL) in December 2017.",Application,tell me about yourself   Answer Question
"Dec 11, 2017","Anonymous Employee in Plano, TX",Junior Associate Auditor (Internal Audit) Interview,Accepted Offer,Positive Experience,Difficult Interview,"I applied through college or university. The process took 2 weeks. I interviewed at FedEx (Plano, TX).",Application,Tell us a time where you were given very little information and had to meet an objective.   1 Answer
"Dec 7, 2017",Anonymous Employee,Inside Account Executive Interview,Accepted Offer,Positive Experience,Difficult Interview,I applied online. The process took 5 weeks. I interviewed at FedEx in December 2017.,Application,Tell me a time you had too....   Answer Question
"Dec 4, 2017","Anonymous Interview Candidate in Jacksonville, FL",Package Handler Interview,No Offer,Positive Experience,Easy Interview,"I applied online. The process took 2 weeks. I interviewed at FedEx (Jacksonville, FL) in November 2017.",Application,Why are you leaving your current job?   Answer Question
"Dec 3, 2017","Anonymous Interview Candidate in Irving, TX",Inside Sales Account Executive Interview,No Offer,Negative Experience,Average Interview,"I applied online. The process took 6 weeks. I interviewed at FedEx (Irving, TX).",Application,Tell me about a time you had a disagreement with a coworker and how did you handle it.   Answer Question
"Dec 1, 2017","Anonymous Employee in Ashland, VA",Part Time Package Handler Interview,Accepted Offer,Positive Experience,Easy Interview,"I applied online. The process took 2 weeks. I interviewed at FedEx (Ashland, VA) in October 2017.",Application,Have I had any previous experience with the company?   1 Answer
"Nov 27, 2017",Anonymous Employee,Sales Representative Interview,Accepted Offer,Positive Experience,Difficult Interview,I applied online. I interviewed at FedEx.,Application,Tell me about a time you had to work in a team environment?   Answer Question
"Nov 24, 2017",Anonymous Interview Candidate,Package Handler Interview,No Offer,Neutral Experience,Easy Interview,I applied online. The process took 4 days. I interviewed at FedEx in November 2017.,Application,Do you have criminal history?   1 Answer
"Nov 16, 2017","Anonymous Employee in Memphis, TN",Senior Software Engineer Interview,Accepted Offer,Positive Experience,Average Interview,"I applied online. The process took 4+ weeks. I interviewed at FedEx (Memphis, TN) in November 2017.",Application,"Tell me challenging situations?
How did you overcome differences in opinion with teammates?
How Agile methodology works?
Why leaving current job?
How did you convince your teammates to pick your solution to a prb?
Accomplishments?
Why FedEx? etc   Answer Question"
"Nov 15, 2017","Anonymous Employee in Atlanta, GA",Operations Manager Interview,Accepted Offer,Positive Experience,Difficult Interview,"I applied in-person. The process took 1 day. I interviewed at FedEx (Atlanta, GA) in January 2013.",Application,How do you deal with an upset customer?   Answer Question
"Nov 14, 2017","Anonymous Employee in Memphis, TN",Senior Software Engineer Interview,Accepted Offer,Positive Experience,Average Interview,"I applied online. The process took 4+ weeks. I interviewed at FedEx (Memphis, TN).",Application,"1. Tell me challenging situations?
2. How do you overcome differences in opinion with teammates?
3. How Agile methodology works?
4. Why leaving current job?
5. How did you convince your teammates to pick your solution to a prb?
6. Accomplishments?
7. Why FedEx? etc   Answer Question"
"Nov 13, 2017",Anonymous Employee,Material Handler Interview,Accepted Offer,Positive Experience,Easy Interview,I applied in-person. The process took 4+ weeks. I interviewed at FedEx in August 2014.,Application,
"Nov 13, 2017",Anonymous Employee,Inside Sales Representative Interview,Accepted Offer,Positive Experience,,I applied through other source. I interviewed at FedEx.,Application,What makes you different from other applicants?   1 Answer
"Nov 13, 2017",Anonymous Employee,IT Interview,Accepted Offer,Positive Experience,Easy Interview,I applied through college or university. The process took a week. I interviewed at FedEx in October 2016.,Application,"The challenges faced at workplace. All the basic behavioral questions were asked, like team player, ambiguity situations.   1 Answer"
"Nov 8, 2017","Anonymous Interview Candidate in Edison, NJ",Package Handler Interview,Declined Offer,Negative Experience,,"The process took 1 day. I interviewed at FedEx (Edison, NJ) in November 2017.",Application,
"Nov 4, 2017","Anonymous Employee in Auburn, WA",Delivery Driver Interview,Accepted Offer,Positive Experience,Easy Interview,"I applied online. The process took 2 days. I interviewed at FedEx (Auburn, WA) in November 2016.",Application,What would you do in a situation where another driver has road rage towards you?   1 Answer
"Nov 2, 2017","Anonymous Interview Candidate in Brookfield, WI",Office Interview,No Offer,Negative Experience,Average Interview,"I applied online. The process took 4+ months. I interviewed at FedEx (Brookfield, WI) in July 2017.",Application,how do you organized your day   1 Answer
"Nov 1, 2017","Anonymous Employee in Oakland, CA",Material Handler Interview,Accepted Offer,Positive Experience,Easy Interview,"I applied online. The process took 2 weeks. I interviewed at FedEx (Oakland, CA) in January 2014.",Application,
"Oct 31, 2017","Anonymous Interview Candidate in Mississauga, ON (Canada)",Sales Associate Interview,No Offer,Neutral Experience,Average Interview,"I applied through college or university. The process took 1 day. I interviewed at FedEx (Mississauga, ON (Canada)) in October 2017.",Application,"Team conflict, three strength, challengable tasks   Answer Question"
"Oct 26, 2017",Anonymous Interview Candidate in Mumbai (India),Human Resources Generalist Interview,No Offer,Negative Experience,Average Interview,"Very slow process. Have been waitlisted, it's been 3 months now and still haven't heard from them. Although the interview experience was very good, they failed to revert after the process, even after repeated reminders.",Application,"Mostly behavioral questions, to analyze your personality.   Answer Question"
"Oct 25, 2017","Anonymous Employee in Phoenix, AZ",Customer Service Interview,Accepted Offer,Positive Experience,Easy Interview,"I applied in-person. I interviewed at FedEx (Phoenix, AZ) in October 2017.",Application,Have to Understand the value of good customer service.   Answer Question
"Oct 20, 2017","Anonymous Employee in Kansas City, KS",Package Handler Interview,Accepted Offer,Positive Experience,Easy Interview,"I applied online. The process took 2 weeks. I interviewed at FedEx (Kansas City, KS) in October 2017.",Application,How you would handle a difficult situation with a co-worker   Answer Question
"Oct 20, 2017","Anonymous Employee in Concord, NC",Part Time Package Handler Interview,Accepted Offer,Positive Experience,Easy Interview,"I applied online. I interviewed at FedEx (Concord, NC) in October 2017.",Application,How do you handle conflicts when they arise?   Answer Question
"Oct 18, 2017",Anonymous Interview Candidate,Associate Financial Analyst Interview,Declined Offer,Positive Experience,Easy Interview,I applied through college or university. I interviewed at FedEx.,Application,Walk me through your resume.   Answer Question
"Oct 17, 2017","Anonymous Employee in Memphis, TN",Class A Truck Driver Interview,Accepted Offer,Positive Experience,Easy Interview,"I applied in-person. The process took 2 weeks. I interviewed at FedEx (Memphis, TN) in August 2017.",Application,Do I want to work part time or full time..   Answer Question
"Oct 17, 2017","Anonymous Employee in Memphis, TN",Material Handler Interview,Accepted Offer,Positive Experience,Easy Interview,"I applied online. The process took 2 weeks. I interviewed at FedEx (Memphis, TN) in August 2014.",Application,I was not personally interviewed it was all done as a group   Answer Question
"Oct 17, 2017","Anonymous Interview Candidate in Spokane, WA",Dock Manager Interview,Declined Offer,Positive Experience,Easy Interview,"I applied online. The process took 1+ week. I interviewed at FedEx (Spokane, WA) in June 2017.",Application,Why do you want to work here   Answer Question
"Oct 17, 2017","Anonymous Employee in Asheville, NC",Part Time Package Handler Interview,Accepted Offer,Positive Experience,Easy Interview,"I applied online. The process took 5 days. I interviewed at FedEx (Asheville, NC) in May 2017.",Application,Are you physically able to repeatedly lift heavy boxes   Answer Question
"Oct 16, 2017","Anonymous Interview Candidate in Palm Springs, CA",Courier Interview,No Offer,Positive Experience,Easy Interview,"I applied online. The process took 1 day. I interviewed at FedEx (Palm Springs, CA) in October 2017.",Application,How dependable would you be?   1 Answer
"Oct 16, 2017",Anonymous Employee,Part Time Package Handler Interview,Accepted Offer,Positive Experience,Easy Interview,It was easy and simple for process for FedEx Ground interview. After one or two weeks they call you for the training for a week and then you start work.,Application,Can you be able to carries over 70 lbs of box?   Answer Question
"Oct 12, 2017","Anonymous Interview Candidate in Phoenix, AZ",Inside Sales Representative Interview,Declined Offer,Positive Experience,Average Interview,"The process took 2 weeks. I interviewed at FedEx (Phoenix, AZ).",Application,How would you manage a territory of 600+ people.   Answer Question
"Oct 12, 2017","Anonymous Employee in Dallas, TX",Center Consultant Interview,Accepted Offer,Positive Experience,Average Interview,"I applied online. The process took a week. I interviewed at FedEx (Dallas, TX) in October 2017.",Application,What type of retail experience do you have?   Answer Question
"Oct 10, 2017","Anonymous Employee in Tampa, FL",FedEx Package Handler Interview,Accepted Offer,Positive Experience,Easy Interview,"I applied online. The process took 2 weeks. I interviewed at FedEx (Tampa, FL).",Application,Why do you want to work here?   1 Answer
"Oct 9, 2017","Anonymous Interview Candidate in Knoxville, TN",Internal Auditor Interview,No Offer,Neutral Experience,Easy Interview,"I applied through college or university. The process took 4+ weeks. I interviewed at FedEx (Knoxville, TN) in February 2013.",Application,Do you know anyone who works for FedEx?   Answer Question
"Oct 9, 2017","Anonymous Employee in Austin, TX",Worldwide Account Manager Interview,Accepted Offer,Positive Experience,Difficult Interview,"I applied online. The process took 5 weeks. I interviewed at FedEx (Austin, TX) in August 2013.",Application,Tell me about a time when something went completely wrong and that you could not overcome. What was it? How did you handle the situation. what did you learn?   Answer Question
"Oct 8, 2017","Anonymous Interview Candidate in Little Rock, AR",Handler Interview,No Offer,Positive Experience,Average Interview,"I applied online. I interviewed at FedEx (Little Rock, AR) in January 2016.",Application,where do I want to be in 1 year   Answer Question
"Oct 8, 2017",Anonymous Employee in Kolkata (India),Customer Service Representative Interview,Accepted Offer,Negative Experience,Easy Interview,I applied through a recruiter. I interviewed at FedEx (Kolkata (India)) in November 2016.,Application,Tell me about your self   1 Answer
"Oct 6, 2017","Anonymous Employee in Tampa, FL",Retail Sales Associate Interview,Accepted Offer,Positive Experience,Average Interview,"I applied online. The process took 3 weeks. I interviewed at FedEx (Tampa, FL) in September 2017.",Application,"Name a time you had to deal with a difficult customer, how did you handle it, was the customer satisfied?   Answer Question"
"Oct 6, 2017",Anonymous Employee,Internal Auditor Interview,Accepted Offer,Positive Experience,Average Interview,I applied through college or university. The process took a week. I interviewed at FedEx.,Application,Describe a time you had a set plan but had to change the plan and how did you handle that?   Answer Question
"Oct 5, 2017","Anonymous Employee in Bedford Park, IL",Part Time Package Handler Interview,Accepted Offer,Positive Experience,Easy Interview,"I applied online. I interviewed at FedEx (Bedford Park, IL) in October 2017.",Application,How would u handle a conflict between you and a co-worker?   1 Answer
"Oct 3, 2017","Anonymous Employee in McCook, IL",Package Handler Interview,Accepted Offer,Positive Experience,Easy Interview,"I applied online. The process took 3 days. I interviewed at FedEx (McCook, IL) in September 2017.",Application,"If you and your supervisor were having a problem, how would you solve it?   Answer Question"
"Oct 3, 2017",Anonymous Employee,Software Engineer Interview,Accepted Offer,Positive Experience,Difficult Interview,I applied online. The process took 2+ months. I interviewed at FedEx in February 2017.,Application,Where do you see yourself in 10 yrs.   1 Answer
"Oct 3, 2017",Anonymous Employee,HR Generalist Interview,Accepted Offer,Neutral Experience,Difficult Interview,I applied through other source. I interviewed at FedEx.,Application,Have you made mistakes?   1 Answer
"Oct 1, 2017",Anonymous Employee,Global Marketing/Communications Interview,Accepted Offer,Positive Experience,Average Interview,I applied online. The process took 4 weeks. I interviewed at FedEx in November 2016.,Application,Tell us about a time when you were in a leadership position? Tell us about a time when you had to work on a team?   Answer Question
"Sep 19, 2017","Anonymous Interview Candidate in Saint Paul, MN",Package Handler Interview,Declined Offer,Positive Experience,Easy Interview,"I applied online. I interviewed at FedEx (Saint Paul, MN) in September 2017.",Application,Why did you leave your last job?   Answer Question
"Sep 18, 2017",Anonymous Employee,Truck Driver Interview,Accepted Offer,Positive Experience,Easy Interview,I applied in-person. I interviewed at FedEx.,Application,They didn't really. I was already working for them. It made it really easy.   Answer Question
"Sep 14, 2017","Anonymous Interview Candidate in Memphis, TN",Programmer Analyst Interview,No Offer,Negative Experience,Easy Interview,"I applied online. I interviewed at FedEx (Memphis, TN) in July 2017.",Application,Standard Behavioral Questions and Questions on your resume   Answer Question
"Sep 6, 2017","Anonymous Employee in Breinigsville, PA",Part Time Package Handler Interview,Accepted Offer,Positive Experience,Easy Interview,"I applied online. I interviewed at FedEx (Breinigsville, PA) in September 2016.",Application,Is the information you provided correct.   1 Answer
"Sep 5, 2017","Anonymous Employee in Memphis, TN",Intern - Hourly Interview,Accepted Offer,Positive Experience,Average Interview,"I applied online. I interviewed at FedEx (Memphis, TN) in December 2016.",Application,Basic behavioral questions with scenarios   1 Answer
"Aug 26, 2017",Anonymous Interview Candidate,Operations Administrator Interview,No Offer,Neutral Experience,Difficult Interview,I applied online. I interviewed at FedEx in August 2017.,Application,"I think there were 8 loaded questions

1. Give me an example of a process you created that improved efficiently and what were the results.

2. How do you deal with a difficult coworker?

3. How do you approach your supervisor with an idea or issue?   Answer Question"
"Aug 25, 2017","Anonymous Employee in Ellenwood, GA",Part Time Package Handler Interview,Accepted Offer,Positive Experience,Easy Interview,"I applied online. I interviewed at FedEx (Ellenwood, GA) in August 2017.",Application,How did you find out about this job?   Answer Question
"Aug 25, 2017","Anonymous Employee in Buffalo, NY",Dock Worker Interview,Accepted Offer,Positive Experience,Average Interview,"I applied online. I interviewed at FedEx (Buffalo, NY) in August 2017.",Application,Did I know math and measurements   1 Answer
"Aug 23, 2017","Anonymous Interview Candidate in Harrison, AR",Call Center Representative Interview,Declined Offer,Neutral Experience,Average Interview,"I applied online. I interviewed at FedEx (Harrison, AR) in April 2015.",Application,Mostly behavioral questions with a few goal questions   1 Answer
"Aug 22, 2017","Anonymous Employee in Chicago, IL",Sales Interview,Accepted Offer,Positive Experience,Average Interview,"I applied in-person. The process took 2 weeks. I interviewed at FedEx (Chicago, IL) in July 2017.",Application,Where do you see yourself in five years.   Answer Question
"Aug 11, 2017","Anonymous Employee in Collierville, TN",Intern Interview,Accepted Offer,Positive Experience,Easy Interview,"I applied online. I interviewed at FedEx (Collierville, TN) in December 2016.",Application,How do you deal with a disagreement within the team?   1 Answer
"Aug 4, 2017","Anonymous Interview Candidate in Chicago, IL",Team Leader Interview,Declined Offer,Positive Experience,Average Interview,"I applied online. I interviewed at FedEx (Chicago, IL) in May 2017.",Application,What are your strength and weaknesses   1 Answer
"Aug 1, 2017","Anonymous Employee in Burlington, ON (Canada)",Associate Financial Analyst Interview,Accepted Offer,Positive Experience,Average Interview,"I applied through college or university. I interviewed at FedEx (Burlington, ON (Canada)) in March 2016.",Application,Walk us through your resume   Answer Question
"Jul 28, 2017","Anonymous Employee in Greeley, CO",Delivery Driver Interview,Accepted Offer,Negative Experience,Easy Interview,"I applied online. I interviewed at FedEx (Greeley, CO) in June 2017.",Application,"they just asked standard job questions like can you handle the weather, can you lift this amount of weight. just the standard job questions.   2 Answers"
"Jul 23, 2017","Anonymous Employee in Linwood, PA",Truck Driver Interview,Accepted Offer,Neutral Experience,Easy Interview,"I applied online. I interviewed at FedEx (Linwood, PA) in June 2017.",Application,what days do I prefer to be off.   1 Answer
"Jul 18, 2017","Anonymous Interview Candidate in Memphis, TN",Systems Analyst Interview,No Offer,Positive Experience,Difficult Interview,"I applied through a recruiter. I interviewed at FedEx (Memphis, TN) in April 2017.",Application,Tell me about a time when you were faced with a difficult customer and you couldn't agree with what they were saying.   Answer Question
